{
  "$schema": "https://json-schema.org/draft/2020-12/schema",
  "title": "Coastal Risk Extent Data",
  "type": "object",
  "required": ["title", "description", "metrics"],
  "properties": {
    "title": { "type": "string", "minLength": 1 },
    "description": { "type": "string", "minLength": 1 },
    "metrics": {
      "type": "array",
      "items": {
        "type": "object",
        "required": ["id", "label"],
        "properties": {
          "id": { "type": "string", "minLength": 1 },
          "label": { "type": "string", "minLength": 1 },
          "value": { "type": ["number", "null"] },
          "unit": { "type": ["string", "null"] },
          "description": { "type": ["string", "null"] }
        },
        "additionalProperties": false
      }
    },
    "mapLink": {
      "anyOf": [{ "$ref": "#/$defs/externalLink" }, { "type": "null" }]
    }
  },
  "additionalProperties": false,
  "$defs": {
    "externalLink": {
      "type": "object",
      "required": ["label", "url"],
      "properties": {
        "label": { "type": "string", "minLength": 1 },
        "url": { "type": "string", "format": "uri" }
      },
      "additionalProperties": false
    }
  }
}
